,transcript,filename,unique_id,extramarital affair,get divorced,illegitimate child,institutionalized for emotional problem,serious accident,murdered,attempt suicide,blackmailed,unfaithful spouse,abortion,score_max
3,"Oh, Tan.  Lauren won't come home.  Still. ",5305617339184877785,1689_5305617339184877785,2.1096528897886366,3.0373957113456713,2.5885184155395455,2.218772928249726,3.425894674930327,46.763548831280296,1.5389229487801797,0.4878641236298479,2.2161782201504616,-0.06430632832825395,46.763548831280296
7,You gave her away and she died. ,5316007724067368375,1859_5316007724067368375,1.5204590477337083,8.675417449891658,9.648342948534005,-0.4176371429262675,3.9751198567215553,41.119161801594295,0.33952899012455096,0.6427014964844592,2.3351048055110013,17.703157647384636,41.119161801594295
8,"I went with somebody today while  she went to have an abortion. One of those new kind of  abortions, done with pills. She took the first one today,  she's got to go back for the second lot tomorrow. She kept asking me  was she doing the right thing? Yeah.  Well, you know,  it's difficult. She's a kid, She's got no money,  no home, her family's miles away, her mother's dead.",5300433743159556513,20_5300433743159556513,-0.3137510957596055,-0.35436593642222636,17.71777466056787,-0.44299830729404316,-0.26877286436422027,0.005003079291603409,-0.3449871846720161,-0.35932180631776967,-0.4854382859940342,34.71467798977756,34.71467798977756
9,You had an abortion?  Yes.  I went to her for advice. ,5316007724067368375,1658_5316007724067368375,-0.35033374357832575,-0.3530327617178216,14.474069444062353,0.21039819337170643,0.19710388979022192,10.624165771415027,-0.3145777352822154,-0.305067895424986,-0.09131582708995863,34.6793838606215,34.6793838606215
10,And you said it was the best thing  you ever did. Because I wanted to make you  feel better about the abortion! I'm not your mother. ,5321170704253895214,1813_5321170704253895214,-0.4830112177541954,-0.33089848043487974,13.97101378490111,-0.04063990482136824,-0.23048297430787335,0.01475897094670345,-0.33592653086763313,0.7503654136593403,-0.3730366772785269,34.49985128217969,34.49985128217969
12,You booked an abortion? ,5300410550331962313,97_5300410550331962313,0.23217842471500413,-0.35785771546446693,13.3326437950602,0.2719849311818254,0.15285365465170803,11.649017156128528,-0.3092936619987059,2.6763047703450344,0.80635408917566,33.145746214123015,33.145746214123015
13,"I'm just being honest.  You want honesty, do you? A month ago, your drunken mistake  meant my mate had to abort your baby! Still think a drink's gonna sort  everything out?",5310822839547632763,396_5310822839547632763,0.4512550249125845,-0.06710462441224559,13.232481201036883,-0.2529509875037723,4.301164714444285,1.0737090438731325,-0.25870186982908966,-0.14112376410034325,2.205156951482873,33.1321460248802,33.1321460248802
15,TAT-TOO!  TAT-TOO!  TAT-TOO!  You want to see it?  Is that it?  All right!,5308226531817199474,1659_5308226531817199474,1.0041131245668673,0.5077804497553269,0.8743261781149834,-0.03786833226442716,1.826080998181301,32.339467326890784,2.506827935185342,0.897942552369263,0.23146748215050614,0.6848613614166744,32.339467326890784
16,"No, let's scrap  flamin' Lady Chatterley.",5305617339184877785,1195_5305617339184877785,1.0004220164459567,0.25827072555552627,-0.21799192488351343,0.4570129724604213,-0.09982299489404077,32.29607390932444,-0.31148709910896305,3.0531704810479505,-0.15267685654644014,-0.35299308218338366,32.29607390932444
18,cause the womb to contract  and the loss of the pregnancy.,5300410550331962313,1400_5300410550331962313,-0.11865052653490314,-0.34792568313055144,3.417341747141277,-0.48843968949796496,1.403672596975168,4.854894460153801,-0.08947363514452943,-0.05062175501288126,-0.29047702016266946,30.185329850903937,30.185329850903937
19,"I lost Sean, I lost my future... ",5316007724067368375,699_5316007724067368375,-0.2578018165067692,9.437449417795214,-0.25357316782120465,1.3090219147696238,2.4981377147301314,29.862576141888518,0.2402300666714725,-0.05359099810208102,2.416450081717051,0.06107960415196274,29.862576141888518
20,"He's sweet. You like him? Yeah, he's gorgeous.  He's yours. What?  Have him.  He's housetrained. He's very affectionate. And he doesn't slobber.  Much.  What, you don't want him? He's more trouble than a  newborn baby, that one. A baby wouldn't be much trouble.  A baby would be a doddle  compared to Gumbo. Stacey told me  she had an abortion. Did she? Was it when you were together?  Look, I thought we were  talking about the dog. Sorry.  I'm sorry,  I don't know why I... Must be because it's the  middle of the night.  Sorry. Well, yes.  Yeah, it was when we were together.  I shouldn't have mentioned it.  It's a while ago now.  It's fine. I'm really sorry. ",5300433743159556513,2_5300433743159556513,3.5490559972192353,4.984003390960483,14.784768134017758,1.4771179728615258,2.3461603544066603,3.143451121218543,2.1357541327803227,3.8152462046536026,2.154068359298392,28.97359415115308,28.97359415115308
29,"I'm just saying, her,  her eyes and...I just think",5313398531435045858,1066_5313398531435045858,0.3719878012394267,0.6650829931765767,0.13649362082937114,-0.14207887466463157,1.4363665814893656,21.315245051119668,0.27224425240092137,0.20119082359979124,0.9770544470621915,-0.0007894701421420331,21.315245051119668
32,"You know that devil costume  he had on at Halloween? Yeah. Well, let's just say it's not  the first time I've been cast down into the fiery pit.",5308226531817199474,1244_5308226531817199474,-0.1930329576778882,-0.10329704970851328,-0.22830199133378054,-0.34643704071874637,0.7809723409757146,19.711753393692632,-0.22754334715455238,0.37308690507028713,0.7240886607918117,-0.3503925501766034,19.711753393692632
34,Because she thinks you're dead. ,5316007724067368375,1680_5316007724067368375,-0.03473868733108282,0.749509258314587,-0.25367527622193603,5.114231527200231,0.9042358304769151,18.331224626862173,-0.21427699217174864,3.096834461616463,0.2502717560489709,0.19380122008354503,18.331224626862173
35,"Oscar's asleep, so don't wake  him unless you have to.  Come on, Abs, we'll drop you off on the way. You really think we'll  get a verdict today? It's possible.  Depends, don't it?  How long the jury sit for.  How long Lauren's testimony takes. If they do to her what they done  to me. Oi, if you can't keep your temper, you'd better not come.",5323778608396028180,1085_5323778608396028180,2.0376045116328627,2.253103012791341,1.1240906161282014,2.225554108653216,2.011067684237727,18.057320547694623,1.1176528332984572,6.502970191741158,2.0842110062379473,2.969183094609626,18.057320547694623
38,"As she picked up the pill  and she raised it to her mouth, and I wanted to grab hold  of her and say, ""Don't do it.",5300433743159556513,23_5300433743159556513,0.9571385326443466,-0.18185361707082065,-0.09328361057135919,-0.3907158813425009,0.2499231162544569,0.08319869179198919,17.00865435311483,2.8626343617859336,1.0817994645082045,17.52290893791567,17.52290893791567
40,"exact words as detailed in  your statement, Mrs Branning. It was a mistake, all right?  Cos she's only a kid.",5323778608396028180,771_5323778608396028180,-0.3628392570820576,-0.20689236853378215,16.722430853652803,-0.5385703908673675,-0.26683559901693277,-0.2385077789226213,0.10930648766042746,-0.26895781814877934,-0.34640624031901945,-0.05701117007018576,16.722430853652803
41,"I can't.  When I lie down, all I can  see is Danielle lying in the road. Danielle lying on a slab. ",5323778608396028180,1252_5323778608396028180,-0.040081209061009794,-0.23040283413219825,-0.2900555517253368,-0.1405761524555908,3.6445629964790554,16.570980321395922,0.167794154332567,-0.2555127544263256,0.4097304692324805,-0.2921930423899408,16.570980321395922
44,"What's happened?  Nothing, right?  That's why you haven't phoned me,  because you haven't said anything. Yes.  I have.  You've told her?  I had another try.  Just a few minutes ago as a matter  of fact.  I sat her down, I talked to her about when she was a kid. Talked about the baby, the pregnancy.  And she crumpled?  Yeah. Just like last time?  It was like somebody had whipped  her legs out from underneath her. Then off she went.  She's got  loads of stuff to do for the wedding. She jumped in a taxi, said she needed  a few hours away from everybody. I've told you  how close she is to the edge. Do you really want me to  push her over? No. I've been acting like  a spoilt kid, haven't I? I want this, I want that.  I'm sorry.  Grandad, I really am.  When you're so  close to finally getting what... I haven't really been  very fair on you, have I? No, no, no you haven't.  I've been thinking about it all day.  What I've been putting you through  and I don't want you to do anything, not any more. I'm gonna  take responsibility instead. So whatever happens now,  it's all down to me. What are you talking about?  She's your daughter.  You want to  protect her, of course you do, how can I expect anything else? Don't you want to protect  your own mother? No-one knows how she's gonna react.  Of course they don't, that's the point. OK, it's a risk and it's not  one I'm gonna ask you to take.",5321170704253895214,284_5321170704253895214,1.2287099397004342,0.9571181497581035,9.458560677491187,2.384588162688228,2.4218679075867526,1.8547224807151956,16.026382070975014,7.584103288093243,0.7250533198834825,5.357724993253202,16.026382070975014
46,"Well, you're a liar!  You're a liar!  He told you! He, he said that he told you!  He said that you didn't want me. ",5321170704253895214,1792_5321170704253895214,1.782408894937864,4.862755564575015,15.408181438575387,2.9708878556836593,0.549349725178317,6.416469479730852,1.856287759666318,6.906097499595148,2.5742695425623654,8.441880292594602,15.408181438575387
48,Have you any idea what  she's done to me?,5316007724067368375,1651_5316007724067368375,2.583118247318183,4.113026294461708,0.6813631023936321,0.7836283118229229,3.6406166693462807,15.198470699774592,0.6551594124817993,5.01385268950613,2.494419822007227,3.0858423614976815,15.198470699774592
52,"I tell you what,  if you weren't my flesh and blood, I'd cancel your invitations! Oh, Archie!  Tracey said the cider's gone off. What?  Can't have done, we only  changed the barrel yesterday! It must be the pipes. It's all right, I'll have  a look when I've put the little one down. No, you're all right. It's all right.  Go on.  I'll put her down.",5318609185758554501,1764_5318609185758554501,1.6031542236017082,0.4027808759619371,14.411194946022391,0.8886157247629554,2.816959661878871,4.056741775299769,3.9430289889669963,8.630166953821353,1.8281720843764357,1.310892578641655,14.411194946022391
54,If she'd been allowed to live. ,5300433743159556513,243_5300433743159556513,1.2077479648120037,-0.09954215736169239,5.463101102231195,3.085439736399672,2.9267551446170263,14.337397270262734,4.71038809914838,0.5454673101855652,1.541856948900663,11.08820389740751,14.337397270262734
56,"And, actually, I was fine.  No, I wasn't fine, but I managed.  It's what she wanted to do.  She's only a kid.  She's got no money, no boyfriend.",5300433743159556513,239_5300433743159556513,-0.5166354861684003,-0.2809353544659151,13.220495237864998,-0.5014028385507415,-0.2764967328483058,-0.23994498375010254,0.781446759301249,-0.37907055112488564,-0.4702231770222957,-0.1378173062390887,13.220495237864998
59,"Go on, blow them out. ",5308226531817199474,1650_5308226531817199474,1.4297099154968174,0.879926480748832,0.6386264899410362,-0.16065632254113024,0.7253363561611826,9.192552186654757,1.1795096000704812,-0.012297440317828959,1.128543750191943,12.854494873861448,12.854494873861448
60,No.  Not until that night. ,5323778608396028180,834_5323778608396028180,1.936937296957489,1.2405668395471232,1.923963376481705,1.1487377710695836,2.385517846717988,12.784902710821523,4.780514505361271,1.401374201921993,1.6169963372730718,2.4885297572874596,12.784902710821523
61,"Danielle?!  # Hush, little baby  Don't say a word # Mama's gonna buy you  A mockingbird...  #",5316007724067368375,784_5316007724067368375,0.9747293730946999,-0.049151192047102936,12.133795758540282,-0.1884197562724136,-0.12552636924833993,-0.18059299789178052,-0.19882686264093277,11.790394538227458,1.032210847829824,-0.06311872687414515,12.133795758540282
63,Tan.  I covered for Lauren trying to kill you.  That's perverting the course of justice.,5305617339184877785,1413_5305617339184877785,4.025177466835105,0.09432212298107327,-0.21313156161808627,1.8243688749235456,-0.1443416514146848,11.910840945866955,2.414625377213583,4.482460290187061,2.8347301697840788,3.8586264932003274,11.910840945866955
65,"I'm gonna be in the public gallery.  You're gonna be fine, OK?  Good luck.  Thanks.  I'm not sure I can handle this, you know. Seeing my little girl in the dock.  I know what it's like.  You can. She's only a baby.  But she's strong though, in't she?  She's proved that. And we've gotta be too.  You OK?  Right.  We all  know what we've gotta do.",5323778608396028180,654_5323778608396028180,-0.21472057873685657,0.1818971908731575,11.810353777424039,0.23456407515987965,2.9179538172373842,4.515487681713364,0.663506825495891,1.556690446199474,-0.13991010483514257,2.5177068464161896,11.810353777424039
72,"Grieved, you said.  Grieved.  Mmm.  At the loss.  She still thought she'd done the  right thing.  For you.  For the baby. But she didn't. ",5316007724067368375,1740_5316007724067368375,0.12523143140794604,0.8043627827925024,11.602634334012473,0.3879689056537143,1.052942737409988,2.149060969032386,0.5288736741182437,0.10180869289381972,0.6222547861049144,9.485524709610072,11.602634334012473
73,"I know.  And knowing  that's the worst of it. Because now I've got to  go home and tell her, haven't I? Got to look at that little face  and pretend everything's gonna be all right. I've got to pretend I'm happy.  Make out that it's all OK.",5305617339184877785,1699_5305617339184877785,0.6817697005845379,1.3674094372928687,11.4954214287109,1.7785805845608071,2.166126464291526,1.2201474893225466,0.31459645723574514,2.0315691792398693,1.0745624141804089,1.982987716635486,11.4954214287109
75,"You don't want Ian  to ground you for another week. I'm quaking in my boots.  Oi, less of that lip, you'll end up on the naughty step.",5313398531435045858,256_5313398531435045858,-0.02978507606366522,-0.3290071859303577,-0.29414955101017964,4.026418543194774,0.13960946602313473,0.13446599853384644,-0.2776616028128748,11.320949729812227,0.3720354772910552,-0.27189357930014635,11.320949729812227
76,And knowing that I've got  to go home now without her again.,5305617339184877785,1697_5305617339184877785,0.4897145867309162,7.6467170030706955,0.4467848265543313,1.837295070312238,1.7749185961494445,11.278915144980495,-0.07565652594064301,0.8752602002877763,1.2769853062010628,1.2016970351274323,11.278915144980495
80,"Oh, come on, listen, listen darlin',  you just let me and my friend in, and Jane here will give you  a little pole-dance.  Eh? Oi, you!",5310822839547632763,330_5310822839547632763,3.679519639705384,-0.32488972945789213,0.20700554921352612,-0.15396678085782162,-0.2922020327446755,-0.2196173288987116,-0.3654639672779281,10.984109611862069,0.5971956462100831,-0.3498102158643125,10.984109611862069
81,You've got to give me what I want? ,5323778608396028180,1263_5323778608396028180,-0.07958469879120271,0.08900308728026071,-0.1559732183210394,2.1927877695627878,-0.10055334411707724,0.04997852845764929,-0.24434262820078695,10.871866290333594,-0.2284044454145426,0.5057935593617923,10.871866290333594
83,"Hey, come on, sleep on the sofa!  Better still, why don't I sleep  on the sofa and give them my bed?",5305617339184877785,1599_5305617339184877785,0.37894018564267506,0.20241601802836146,-0.19653481842427,-0.39603720897066247,-0.2896359020343437,-0.22351060178701898,-0.24105008350532353,10.683229022865696,-0.22870720549493861,-0.15308598495849618,10.683229022865696
84,"Yes.  And you can tell her  directly from me, Charlie Slater, she is to stay away from my family! ",5316007724067368375,1077_5316007724067368375,1.216799773197208,2.7153167656857953,7.613588719220533,-0.1014242626563514,0.6572277850447206,1.4054853921309494,1.1354749976781613,10.628609957496263,2.0893680521566806,0.4963157831019546,10.628609957496263
89,Mum and Dad told me I was  adopted when I was five. It didn't mean much to me then. ,5300433743159556513,27_5300433743159556513,-0.48961231771980035,-0.27993806376652125,10.422272478403439,-0.37964370407187464,-0.28878295068122745,-0.2231897816055427,-0.30571666306109396,-0.30510644217185295,-0.4602776323685036,-0.3146323382293502,10.422272478403439
95,"it ain't necessarily  what's gonna happen. The prosecution, they're gonna try  make out that it was pre-meditated,",5323778608396028180,589_5323778608396028180,-0.39418284736158027,0.2651442392730606,0.33718465634201766,-0.4592197826731936,-0.29518012926564235,9.989880207639764,5.871450661551256,-0.030455510933361105,0.1568574485273895,3.878388611915349,9.989880207639764
